{
  "schemaVersion": 1,
  "stage": "2.14",
  "status": "route-ready",
  "policyVersion": "1.0.0",
  "profile": {
    "id": "fa-ir-g1",
    "status": "draft"
  },
  "summary": {
    "adjudicationRecords": 253,
    "approved": 153,
    "deferred": 100,
    "candidateAdmissionEligible": 138,
    "approvedNonMaterializable": 15,
    "normativePromotionAuthorized": 0,
    "promotionEligible": 0,
    "candidateArtifactsMaterialized": 0
  },
  "governanceBoundary": {
    "admissionTargetStatus": "candidate",
    "admissionIsNormativePromotion": false,
    "phase1ClassificationRewritten": false,
    "officialIranianStandardClaim": false,
    "separatePromotionRecordRequired": true,
    "profileStatusChangesAutomatically": false
  },
  "inputs": {
    "adjudicationManifest": {
      "path": "spec/fa-ir/adjudications/manifest.json",
      "sha256": "C42F7BC4373B22FAA6249B3C3576F2DC941C61C52BAC0799FB63A90DBD5318A8"
    },
    "adjudicationPolicy": {
      "path": "spec/fa-ir/governance/adjudication-policy.json",
      "sha256": "FAE2FD05675A6C068053FBAD7361F4FE1F907F23A6893AED3A8E6A0AD61ED757"
    },
    "normativePromotionPolicy": {
      "path": "spec/fa-ir/governance/normative-promotion-policy.json",
      "sha256": "2A0558A9ECE46F9C8B9D550E7F08B835D863F40E0946CA27939D369DA59D96CE"
    },
    "profile": {
      "path": "spec/fa-ir/profiles/fa-ir-g1.json",
      "sha256": "A145FF5DA6EA145CF97ABAEE004472E46F30E4859E8B150F70A504B73B3D9E4E"
    }
  },
  "entries": [
    {
      "adjudicationRecordId": "FA-ADJ-DIGIT-ARABIC-INDIC-0-001",
      "adjudicationRecordPath": "spec/fa-ir/adjudications/records/fa-adj-digit-arabic-indic-0-001.json",
      "adjudicationRecordSha256": "6318E04C48942230AD89AC966415867157C659F014F71EA49A9445D48DBE36C0",
      "decisionItemId": "FA-DIGIT-ARABIC-INDIC-0",
      "phase1Classification": "REVIEW-REQUIRED",
      "disposition": "accept-rule",
      "targetRuleType": "character",
      "targetStatus": "candidate",
      "candidateMaterializationAuthorized": true,
      "candidateRuleId": null,
      "conformanceVectorIds": [],
      "promotionEligible": false,
      "normativePromotionAuthorized": false,
      "requiresSeparatePromotionRecord": true,
      "evidencePacketPath": "spec/fa-ir/review/evidence-packets/records/fa-digit-arabic-indic-0.json",
      "evidencePacketSha256": "D60C2A6D893DD278313AB2AF9B9A4FBC2B5E52E7AC593E4A8D55845B73A91021"
    },
    {
      "adjudicationRecordId": "FA-ADJ-DIGIT-ARABIC-INDIC-1-001",
      "adjudicationRecordPath": "spec/fa-ir/adjudications/records/fa-adj-digit-arabic-indic-1-001.json",
      "adjudicationRecordSha256": "73E1171F30CCF2BD261794411D1BD771AF8598222D465E5DBFAE4D46798CAE4F",
      "decisionItemId": "FA-DIGIT-ARABIC-INDIC-1",
      "phase1Classification": "REVIEW-REQUIRED",
      "disposition": "accept-rule",
      "targetRuleType": "character",
      "targetStatus": "candidate",
      "candidateMaterializationAuthorized": true,
      "candidateRuleId": null,
      "conformanceVectorIds": [],
      "promotionEligible": false,
      "normativePromotionAuthorized": false,
      "requiresSeparatePromotionRecord": true,
      "evidencePacketPath": "spec/fa-ir/review/evidence-packets/records/fa-digit-arabic-indic-1.json",
      "evidencePacketSha256": "6CB10B484471BEDA379FC9D9B5947A8C4EBCD8C76010EDF18A2AD7C9D1A99FA4"
    },
    {
      "adjudicationRecordId": "FA-ADJ-DIGIT-ARABIC-INDIC-2-001",
      "adjudicationRecordPath": "spec/fa-ir/adjudications/records/fa-adj-digit-arabic-indic-2-001.json",
      "adjudicationRecordSha256": "A3F5B2B932C4FE8194FF087E5758B9AD4D6D437E8576C89A3FF6300928E11CFD",
      "decisionItemId": "FA-DIGIT-ARABIC-INDIC-2",
      "phase1Classification": "REVIEW-REQUIRED",
      "disposition": "accept-rule",
      "targetRuleType": "character",
      "targetStatus": "candidate",
      "candidateMaterializationAuthorized": true,
      "candidateRuleId": null,
      "conformanceVectorIds": [],
      "promotionEligible": false,
      "normativePromotionAuthorized": false,
      "requiresSeparatePromotionRecord": true,
      "evidencePacketPath": "spec/fa-ir/review/evidence-packets/records/fa-digit-arabic-indic-2.json",
      "evidencePacketSha256": "20E296FBA402C970D5F77E52B3E84C84A676DCCD7CC45D57629B8F1B73004628"
    },
    {
      "adjudicationRecordId": "FA-ADJ-DIGIT-ARABIC-INDIC-3-001",
      "adjudicationRecordPath": "spec/fa-ir/adjudications/records/fa-adj-digit-arabic-indic-3-001.json",
      "adjudicationRecordSha256": "5AF91290749046E37725D4079405C8FD97FCE70EF67AFF5E8C2ED8F7A136F783",
      "decisionItemId": "FA-DIGIT-ARABIC-INDIC-3",
      "phase1Classification": "REVIEW-REQUIRED",
      "disposition": "accept-rule",
      "targetRuleType": "character",
      "targetStatus": "candidate",
      "candidateMaterializationAuthorized": true,
      "candidateRuleId": null,
      "conformanceVectorIds": [],
      "promotionEligible": false,
      "normativePromotionAuthorized": false,
      "requiresSeparatePromotionRecord": true,
      "evidencePacketPath": "spec/fa-ir/review/evidence-packets/records/fa-digit-arabic-indic-3.json",
      "evidencePacketSha256": "77AE3F120BEE1F28A3B82FE1D9861245B1D01CA8EE4FC9114F11D24F8C382466"
    },
    {
      "adjudicationRecordId": "FA-ADJ-DIGIT-ARABIC-INDIC-4-001",
      "adjudicationRecordPath": "spec/fa-ir/adjudications/records/fa-adj-digit-arabic-indic-4-001.json",
      "adjudicationRecordSha256": "C75E12E213D6B451D4649ED64251D1FEDC72375152D4E18E9FCBCE972498C655",
      "decisionItemId": "FA-DIGIT-ARABIC-INDIC-4",
      "phase1Classification": "REVIEW-REQUIRED",
      "disposition": "accept-rule",
      "targetRuleType": "character",
      "targetStatus": "candidate",
      "candidateMaterializationAuthorized": true,
      "candidateRuleId": null,
      "conformanceVectorIds": [],
      "promotionEligible": false,
      "normativePromotionAuthorized": false,
      "requiresSeparatePromotionRecord": true,
      "evidencePacketPath": "spec/fa-ir/review/evidence-packets/records/fa-digit-arabic-indic-4.json",
      "evidencePacketSha256": "42C99CB4CAF865703409EE18660DEE8185E3D9DF8DB89CD07D7F77A9571AD7EF"
    },
    {
      "adjudicationRecordId": "FA-ADJ-DIGIT-ARABIC-INDIC-5-001",
      "adjudicationRecordPath": "spec/fa-ir/adjudications/records/fa-adj-digit-arabic-indic-5-001.json",
      "adjudicationRecordSha256": "5C6222340C07C85B64295ED37EA933E6E293CB15FF8FA423754505BD6D442C47",
      "decisionItemId": "FA-DIGIT-ARABIC-INDIC-5",
      "phase1Classification": "REVIEW-REQUIRED",
      "disposition": "accept-rule",
      "targetRuleType": "character",
      "targetStatus": "candidate",
      "candidateMaterializationAuthorized": true,
      "candidateRuleId": null,
      "conformanceVectorIds": [],
      "promotionEligible": false,
      "normativePromotionAuthorized": false,
      "requiresSeparatePromotionRecord": true,
      "evidencePacketPath": "spec/fa-ir/review/evidence-packets/records/fa-digit-arabic-indic-5.json",
      "evidencePacketSha256": "EDD74F2CC52AD6CAB29D748D2FBDF8E98BE470CA8C0743DF80C099052B2972C7"
    },
    {
      "adjudicationRecordId": "FA-ADJ-DIGIT-ARABIC-INDIC-6-001",
      "adjudicationRecordPath": "spec/fa-ir/adjudications/records/fa-adj-digit-arabic-indic-6-001.json",
      "adjudicationRecordSha256": "999135D23A6B1B93E2E7172AD687A876349718D8FC91893920AC6BA284D604A6",
      "decisionItemId": "FA-DIGIT-ARABIC-INDIC-6",
      "phase1Classification": "REVIEW-REQUIRED",
      "disposition": "accept-rule",
      "targetRuleType": "character",
      "targetStatus": "candidate",
      "candidateMaterializationAuthorized": true,
      "candidateRuleId": null,
      "conformanceVectorIds": [],
      "promotionEligible": false,
      "normativePromotionAuthorized": false,
      "requiresSeparatePromotionRecord": true,
      "evidencePacketPath": "spec/fa-ir/review/evidence-packets/records/fa-digit-arabic-indic-6.json",
      "evidencePacketSha256": "41625BC96E1BBA153D518F75DB66EF094809277DF181582FD479036DF56E3372"
    },
    {
      "adjudicationRecordId": "FA-ADJ-DIGIT-ARABIC-INDIC-7-001",
      "adjudicationRecordPath": "spec/fa-ir/adjudications/records/fa-adj-digit-arabic-indic-7-001.json",
      "adjudicationRecordSha256": "AEBA734D9C5E19F89E3714FA300D846F864A66938CF04EDF094911503A3BDB20",
      "decisionItemId": "FA-DIGIT-ARABIC-INDIC-7",
      "phase1Classification": "REVIEW-REQUIRED",
      "disposition": "accept-rule",
      "targetRuleType": "character",
      "targetStatus": "candidate",
      "candidateMaterializationAuthorized": true,
      "candidateRuleId": null,
      "conformanceVectorIds": [],
      "promotionEligible": false,
      "normativePromotionAuthorized": false,
      "requiresSeparatePromotionRecord": true,
      "evidencePacketPath": "spec/fa-ir/review/evidence-packets/records/fa-digit-arabic-indic-7.json",
      "evidencePacketSha256": "7CD4FE9D69AAACCD077E440A02E7F1131389B9C7F25389033A013DCB54F9FAF2"
    },
    {
      "adjudicationRecordId": "FA-ADJ-DIGIT-ARABIC-INDIC-8-001",
      "adjudicationRecordPath": "spec/fa-ir/adjudications/records/fa-adj-digit-arabic-indic-8-001.json",
      "adjudicationRecordSha256": "45AB2BAC8C4310A8E2A579730014AF166B58BC0F62FEAD51ECA072205190B41A",
      "decisionItemId": "FA-DIGIT-ARABIC-INDIC-8",
      "phase1Classification": "REVIEW-REQUIRED",
      "disposition": "accept-rule",
      "targetRuleType": "character",
      "targetStatus": "candidate",
      "candidateMaterializationAuthorized": true,
      "candidateRuleId": null,
      "conformanceVectorIds": [],
      "promotionEligible": false,
      "normativePromotionAuthorized": false,
      "requiresSeparatePromotionRecord": true,
      "evidencePacketPath": "spec/fa-ir/review/evidence-packets/records/fa-digit-arabic-indic-8.json",
      "evidencePacketSha256": "9A84831852D1BA2E31D3E298746A83EDB5943C0C0DC084E2E0FDE556C4003D20"
    },
    {
      "adjudicationRecordId": "FA-ADJ-DIGIT-ARABIC-INDIC-9-001",